### ISSUE TITLE
lokid, rpc consumer: on read failed (Parse JSON correctly)

### ISSUE THREAD

**Issue by neuroscr** [loki-project/loki-network#392]
macos & linux
```
lokinet: [ERR] ldl (131) Mon Mar 11 15:43:42 2019 PDT libabyss/src/client.cpp:197	CloseError: on read failed
[ERR] ldl (131) Mon Mar 11 15:43:42 2019 PDT rpc/rpc.cpp:183	service node list not updated
```

I know the lokid rpc port is open and running before I launch lokinet.

**Comment by neuroscr** [comment]
```
Drafting lokinet service node config

[router]
netid=service
nickname=ldl

[dns]
upstream=206.81.96.55
bind=127.3.2.1:53

[netdb]
dir=/root/.lokinet/netdb-service

[bootstrap]
add-node=/tmp/1IGUEHx2.lokinet_signed

[bind]
eth0=1090

[network]
#enabled=false
ifaddr=10.254.0.1/24

[api]
enabled=true
bind=127.0.0.1:28083

[lokid]
enabled=true
jsonrpc=127.0.0.1:38157
username=user
password=pass
service-node-seed=/root/.loki/testnet/key
```

**Comment by neuroscr** [comment]
```
21:31:06.815357 IP 127.0.0.1.43086 > 127.0.0.1.38157: Flags [S], seq 1347557602, win 43690, options [mss 65495,sackOK,TS val 195563323 ecr 0,nop,wscale 7], length 0
E..<:.@.@..(.........N..PR...........0.........
...;........
21:31:06.815384 IP 127.0.0.1.38157 > 127.0.0.1.43086: Flags [S.], seq 3050912685, ack 1347557603, win 43690, options [mss 65495,sackOK,TS val 195563323 ecr 195563323,nop,wscale 7], length 0
E..<..@.@.<............N..;.PR.......0.........
...;...;....
21:31:06.815396 IP 127.0.0.1.43086 > 127.0.0.1.38157: Flags [.], ack 1, win 342, options [nop,nop,TS val 195563323 ecr 195563323], length 0
E..4:.@.@../.........N..PR....;....V.(.....
...;...;
21:31:06.815567 IP 127.0.0.1.43086 > 127.0.0.1.38157: Flags [P.], seq 1:224, ack 1, win 342, options [nop,nop,TS val 195563323 ecr 195563323], length 223
E...:.@.@..O.........N..PR....;....V.......
...;...;POST /json_rpc HTTP/1.0
Accept: application/json
Content-Length: 91
Content-Type: application/json
Authorization: Basic YTph

{"id":"bbb6f08814fe77e7","jsonrpc":"2.0","method":"get_all_service_nodes_keys","params":{}}
21:31:06.816306 IP 127.0.0.1.38157 > 127.0.0.1.43086: Flags [P.], seq 1:396, ack 224, win 350, options [nop,nop,TS val 195563324 ecr 195563323], length 395
E.....@.@.!X...........N..;.PR.....^.......
...<...;HTTP/1.1 401 Unauthorized
Server: Epee-based
Content-Length: 98
Content-Type: text/html
Last-Modified: Tue, 12 Mar 2019 21:31:06 GMT
Accept-Ranges: bytes
WWW-authenticate:Digest qop="auth",algorithm=MD5,realm="monero-rpc",nonce="eXwnaa7fANZHCFeEWtF/Rw==",stale=false
WWW-authenticate:Digest qop="auth",algorithm=MD5-sess,realm="monero-rpc",nonce="eXwnaa7fANZHCFeEWtF/Rw==",stale=false


21:31:06.816315 IP 127.0.0.1.43086 > 127.0.0.1.38157: Flags [.], ack 396, win 350, options [nop,nop,TS val 195563324 ecr 195563324], length 0
E..4:.@.@..-.........N..PR....=9...^.(.....
...<...<
21:31:06.816390 IP 127.0.0.1.38157 > 127.0.0.1.43086: Flags [P.], seq 396:494, ack 224, win 350, options [nop,nop,TS val 195563324 ecr 195563324], length 98
E.....@.@."............N..=9PR.....^.......
...<...<<html><head><title>Unauthorized Access</title></head><body><h1>401 Unauthorized</h1></body></html>
21:31:06.816406 IP 127.0.0.1.43086 > 127.0.0.1.38157: Flags [.], ack 494, win 350, options [nop,nop,TS val 195563324 ecr 195563324], length 0
E..4:.@.@..,.........N..PR....=....^.(.....
...<...<
21:31:06.915839 IP 127.0.0.1.43086 > 127.0.0.1.38157: Flags [R.], seq 224, ack 494, win 350, options [nop,nop,TS val 195563423 ecr 195563324], length 0
E..4:.@.@..+.........N..PR....=....^.(.....
.......<
```

**Comment by neuroscr** [comment]
Digest is now working, getting farther:
```
:
........HTTP/1.1 200 Ok
Server: Epee-based
Content-Length: 144
Content-Type: application/json
Last-Modified: Wed, 13 Mar 2019 22:57:39 GMT
Accept-Ranges: bytes


22:57:39.174039 IP 127.0.0.1.51910 > 127.0.0.1.38157: Flags [.], ack 654, win 359, options [nop,nop,TS val 287157764 ecr 287157764], length 0
E..4.)@.@.T..............#ri.RG....g.(.....
........
22:57:39.174115 IP 127.0.0.1.38157 > 127.0.0.1.51910: Flags [P.], seq 654:798, ack 677, win 359, options [nop,nop,TS val 287157764 ecr 287157764], length 144
E.....@.@.yG.............RG..#ri...g.......
........{
  "id": "d75873c8a9c6a7b3",
  "jsonrpc": "2.0",
  "result": {
    "keys": ["hiujt9q5sc931oouws4sctk6ssu61397cwah6yfac5gszz5fekuy"]
  }
}
```

but

```
[NFO] ldl (760) Wed Mar 13 22:54:02 2019 UTC rpc/rpc.cpp:151    Updating service node list
lokinet: [ERR] ldl (760) Wed Mar 13 22:54:02 2019 UTC libabyss/src/client.cpp:305    CloseError: on read failed
[ERR] ldl (760) Wed Mar 13 22:54:02 2019 UTC rpc/rpc.cpp:180    service node list not updated
```

**Comment by majestrate** [comment]
![weeee](https://user-images.githubusercontent.com/499653/54359889-f4768900-4639-11e9-874a-f4203d5721a1.jpeg)

**Comment by neuroscr** [comment]
no dice
```
lokinet: [ERR] ldl (511) Thu Mar 14 20:07:22 2019 UTC libabyss/src/client.cpp:305	CloseError: on read failed
[ERR] ldl (511) Thu Mar 14 20:07:22 2019 UTC rpc/rpc.cpp:180	service node list not updated
```

**Comment by neuroscr** [comment]
it's working now
